<?xml version="1.0" encoding="UTF-8"?>
<Config 
	xmlns="http://mpeg7audioenc.sf.net/mpeg7audioenc.xsd"
	xmlns:mp7ae="http://mpeg7audioenc.sf.net/mpeg7audioenc.xsd"
	xmlns:xsi="http://www.w3.org/2001/XMLSchema-instance"
   xsi:schemaLocation="http://mpeg7audioenc.sf.net/mpeg7audioenc.xsd http://mpeg7audioenc.sf.net/mpeg7audioenc.xsdmpeg7audioenc.xsd">

  <Module xsi:type="Resizer">
    <HopSize>10</HopSize>
  </Module>

  <Module xsi:type="AudioWaveform" mp7ae:enable="true"/>

  <Module xsi:type="AudioPower" mp7ae:enable="true" />

  <Module xsi:type="AudioSpectrumCentroidSpread" mp7ae:enable="true" />

  <Module xsi:type="AudioSpectrumEnvelope" mp7ae:enable="true">
    <loEdge>62.5</loEdge>
    <hiEdge>16000.0</hiEdge>
    <resolution>1.0</resolution>
  </Module>

  <Module xsi:type="AudioSpectrumFlatness" mp7ae:enable="true">
    <loEdge>250.0</loEdge>
    <hiEdge>16000.0</hiEdge>
  </Module>
</Config>
